{
  "authority_map": {
    "BudgetEnvelope": "resource_and_route_authorization_authority",
    "CQCMAFSConsumerBinding": "consumer_validation_and_current_compatibility_receipt",
    "CQCMAFSIntegrationBinding": "producer_lineage_and_historical_compatibility",
    "CQS": "scientific_question_admission_authority",
    "MAFS": "post_handoff_scientific_route_and_evidence_cognition",
    "SRP": "evidence_obligation_authority"
  },
  "binding_id": "CQCB-5ffb908cb3d22c03",
  "compatibility_checks": [
    {
      "check_id": "CQC_FREEZE_SHA",
      "status": "PASS"
    },
    {
      "check_id": "CQS_SCHEMA_AND_IDENTITY",
      "status": "PASS"
    },
    {
      "check_id": "SRP_OBLIGATION_LINEAGE",
      "status": "PASS"
    },
    {
      "check_id": "BUDGET_AUTHORITY_LINEAGE",
      "status": "PASS"
    },
    {
      "check_id": "PRODUCER_BINDING_SOURCE_CHAIN",
      "status": "PASS"
    },
    {
      "check_id": "PRODUCER_BASELINE_SUPPORTED",
      "status": "PASS"
    },
    {
      "check_id": "M5_CONSUMER_PIN",
      "status": "PASS"
    },
    {
      "check_id": "AUTHORITY_MAPPING",
      "status": "PASS"
    }
  ],
  "compatibility_status": "COMPATIBLE",
  "consumer_adapter_version": "mafs-skill-1.1-package-c.v1",
  "consumer_mafs_accepted_sha": "ecfa39e9fdeced45848c643544477e408e872d60",
  "created_at": "2026-09-06T00:00:00Z",
  "producer_mafs_compatibility_baseline": {
    "commit_sha": "cd09699fc8cc160ab5cfff00a41e714961dd2109",
    "interface_state": "MAFS v3.0-P1.5-RA3 closed execution-boundary state",
    "repository": "mo21cn/mafs-v3-p0"
  },
  "provenance": {
    "consumer_semantics": "mechanical_wrapper_only",
    "integration_semantics": "validated_protocol_handoff",
    "producer_binding_preserved": true,
    "producer_semantics": "preserved_verbatim_by_source_hash",
    "semantic_mutation_count": 0
  },
  "schema_version": "mafs-skill-1.1-cqc-mafs-consumer-binding.v1",
  "source_budget_id": "BE-PACKAGE-C-001",
  "source_budget_sha256": "c49c50ab27cf3c2d41349ef024aefa089dd2857e719c028828bfebcc423ceb04",
  "source_cqc_freeze_sha": "c5c00a19f9812058050ba16ad61b717a1c1f1ca2",
  "source_cqs_id": "CQS-PACKAGE-C-001",
  "source_cqs_sha256": "991ac69049a811245974ebbf506e133d1e49d428502397ba822a799fb2b2695f",
  "source_integration_binding_id": "BIND-PACKAGE-C-001",
  "source_integration_binding_sha256": "293d891b20cee8c380cfb83fd50a62bbe39c64145db6d8f11b6064e5ec72aec2",
  "source_srp_id": "SRP-PACKAGE-C-001",
  "source_srp_sha256": "8b87538ebf027d9a5f91d1dbe691feb7250d210829cb020298675a186d6e6df6",
  "stale_state_status": "CURRENT",
  "translated_input_ids": [
    "MR-CQC-5ae322d48d72"
  ]
}
